{
  "id": "hnd_7c2e9f015a3b",
  "schema_version": "0.1",
  "kind": "handoff_card",
  "topic": "Open Continuity Module + Quark-AI",
  "from_surface": "chatgpt",
  "target_surface": "any_ai",
  "status": "architecture_exploration",
  "decisions": [
    {
      "text": "Le module doit fonctionner local-only.",
      "confidence": "high",
      "authority": false
    },
    {
      "text": "Quark-AI doit rester optionnel.",
      "confidence": "high",
      "authority": false
    }
  ],
  "open_questions": [
    "Quel est le schéma minimal de dépôt fossile ?",
    "Quelle UX rend le consentement fluide sans devenir lourd ?"
  ],
  "boundaries": [
    "Ne pas traiter Quark-AI comme cerveau central.",
    "Ne pas fusionner les comptes IA.",
    "Ne pas créer de mémoire durable sans validation utilisateur."
  ],
  "usable_as": "context_only",
  "created_at": "2026-06-18T11:00:00.000Z"
}
